{"deviceId":"sim-LU-BF1","messageId":"a1f2c3d4-0000-4a00-8b00-000000000001","enqueuedAt":"2026-06-21T10:00:02Z","schemaVersion":"1.0","injectedScenario":"degrading-furnace-LU-BF1","readings":[{"assetId":"LU-BF1","assetType":"BlastFurnace","site":"LU","metric":"ThermocoupleTemp","value":1502.4,"unit":"C","timestamp":"2026-06-21T10:00:00Z","quality":"Suspect","origin":"Synthetic","sourceId":"sim:LU-BF1"},{"assetId":"LU-BF1","assetType":"BlastFurnace","site":"LU","metric":"HeatFlux","value":31.7,"unit":"kW/m2","timestamp":"2026-06-21T10:00:01Z","quality":"Suspect","origin":"Synthetic","sourceId":"sim:LU-BF1"}]}
